{
  "milestone_id": "M-2026-001",
  "date": "2026-06-16T18:05:00Z",
  "title": "Replay Verifier Independence Claim",
  "evidence_url": "https://github.com/jsonwisdom/provenance-audit-kit",
  "replay_artifact": "verify.py",
  "hash": "de1a571969944790a362c7d56f681ce2a3c9d81741bc9ab462a3a82b928ae323",
  "witnesses": [
    {
      "identity": "jaywisdom.base.eth",
      "role": "claim_operator"
    }
  ],
  "impact_statement": "Defines the test where author authority is replaced by replay authority.",
  "category": "EPISTEMIC_SECURITY",
  "civilization_layer": "L6_EPISTEMIC_INFRASTRUCTURE",
  "verification_state": "CLAIM"
}
